{
  "$schema": "https://json-schema.org/draft/2020-12/schema",
  "$id": "https://milu.studio/schemas/skills/quality_checker/input.schema.json",
  "title": "quality_checker input",
  "type": "object",
  "additionalProperties": false,
  "required": [
    "character_bible",
    "style_bible",
    "storyboard_director",
    "video_generation",
    "voice_casting",
    "subtitle_generator",
    "auto_editor"
  ],
  "properties": {
    "character_bible": {
      "type": "object",
      "description": "A successful character_bible runtime envelope."
    },
    "style_bible": {
      "type": "object",
      "description": "A successful style_bible runtime envelope for the same project and episode."
    },
    "storyboard_director": {
      "type": "object",
      "description": "A successful storyboard_director runtime envelope for the same project and episode."
    },
    "video_generation": {
      "type": "object",
      "description": "A successful mock video_generation runtime envelope for the same project and episode."
    },
    "voice_casting": {
      "type": "object",
      "description": "A successful voice_casting runtime envelope for the same project and episode."
    },
    "subtitle_generator": {
      "type": "object",
      "description": "A successful subtitle_generator runtime envelope for the same project and episode."
    },
    "auto_editor": {
      "type": "object",
      "description": "A successful auto_editor runtime envelope for the same project and episode."
    }
  }
}
